<?xml version="1.0" encoding="utf-8" standalone="no"?>
<!DOCTYPE gestures SYSTEM "gesture_data.dtd">
<gestures>
	<gesture>
		<hand side="left">
			<thumb>
				<flex>24</flex>
				<contact>true</contact>
			</thumb>
			<index>
				<flex>15</flex>
				<contact>true</contact>
			</index>
			<middle>
				<flex>32</flex>
				<contact>false</contact>
			</middle>
			<ring>
				<flex>25</flex>
				<contact>false</contact>
			</ring>
			<pinky>
				<flex>0</flex>
				<contact>false</contact>
			</pinky>
			<thumb-index>
				<contact>true</contact>
			</thumb-index>
			<index-middle>
				<contact>true</contact>
			</index-middle>
			<middle-ring>
				<contact>false</contact>
			</middle-ring>
			<ring-pinky>
				<contact>true</contact>
			</ring-pinky>
		</hand>
		<hand side="right">
			<thumb>
				<flex>10</flex>
				<contact>true</contact>
			</thumb>
			<index>
				<flex>14</flex>
				<contact>false</contact>
			</index>
			<middle>
				<flex>25</flex>
				<contact>false</contact>
			</middle>
			<ring>
				<flex>42</flex>
				<contact>true</contact>
			</ring>
			<pinky>
				<flex>34</flex>
				<contact>true</contact>
			</pinky>
			<thumb-index>
				<contact>true</contact>
			</thumb-index>
			<index-middle>
				<contact>false</contact>
			</index-middle>
			<middle-ring>
				<contact>true</contact>
			</middle-ring>
			<ring-pinky>
				<contact>false</contact>
			</ring-pinky>
		</hand>
	</gesture>
</gestures>
