<?xml version="1.0" encoding="utf-8" standalone="no"?>
<!DOCTYPE gestures SYSTEM "gesture_data.dtd">
<gestures>
	<gesture>
		<hand side="left">
			<thumb>
				<flex>0</flex>
				<contact>true</contact>
			</thumb>
			<index>
				<flex>0</flex>
				<contact>true</contact>
			</index>
			<middle>
				<flex>0</flex>
				<contact>true</contact>
			</middle>
			<ring>
				<flex>0</flex>
				<contact>true</contact>
			</ring>
			<pinky>
				<flex>0</flex>
				<contact>true</contact>
			</pinky>
			<thumb-index>
				<contact>true</contact>
			</thumb-index>
			<index-middle>
				<contact>true</contact>
			</index-middle>
			<middle-ring>
				<contact>false</contact>
			</middle-ring>
			<ring-pinky>
				<contact>true</contact>
			</ring-pinky>
                        <accel>
			        <x>0.0</x>
			        <y>0.0</y>
			        <z>0.0</z>
                        </accel>
		</hand>
		<hand side="right">
			<thumb>
				<flex>0</flex>
				<contact>true</contact>
			</thumb>
			<index>
				<flex>0</flex>
				<contact>true</contact>
			</index>
			<middle>
				<flex>0</flex>
				<contact>true</contact>
			</middle>
			<ring>
				<flex>0</flex>
				<contact>true</contact>
			</ring>
			<pinky>
				<flex>0</flex>
				<contact>true</contact>
			</pinky>
			<thumb-index>
				<contact>true</contact>
			</thumb-index>
			<index-middle>
				<contact>true</contact>
			</index-middle>
			<middle-ring>
				<contact>false</contact>
			</middle-ring>
			<ring-pinky>
				<contact>true</contact>
			</ring-pinky>
                        <accel>
			        <x>0.0</x>
			        <y>0.0</y>
			        <z>0.0</z>
                        </accel>
		</hand>
	</gesture>
        <converted-text></converted-text>
	<status>disconnected</status>
	<convert>false</convert>
	<version>1.0</version>
</gestures>
